	date_created	up_votes	title	author
202641	2013-08-04	2338	West Acts Like  Bull in China Shop  in Middle East – Russian PM  Our Western partners sometimes behave like a bull in a china shop — they squeeze in, crush everything and then don t know what to do next. I often find myself astonished at their analysts and how inconsistent their projects are... 	Libertatea
501708	2016-10-23	2015	Chinese police detain person, who posted a video of violent protests in china, for spreading rumors of labor unrest	itoitoito
424364	2015-12-19	563	Isis bans  corrupt  foreign television and calls satellite dishes the  machinations of Satan 	Arooshy123
330596	2014-12-22	329	China sends first 700 strong infantry battalion to South Sudan for UN peacekeeping http://news.xinhuanet.com/english/china/2014-12/22/c_133871006.htm … #Africa	PanAfrica
70998	2011-01-02	162	Chinese police s flight to congo to  rescue  11 chinese women trafficked there backfires after all the women unanimously agree its better to live and earn there, then in china .	vipez
